{
  "$schema": "./scripts/manifest.schema.json",
  "name": "Cathode UI",
  "version": "0.3.0",
  "description": "Retro-future design system — monospace, pixel shapes, motion + haptics + sound + AI-native surfaces. Read this manifest to understand how to compose Cathode primitives without scraping React source.",
  "fontStack": "'JetBrains Mono', 'SF Mono', 'Menlo', 'Consolas', monospace",
  "themes": [
    "light",
    "dark"
  ],
  "themeSelection": "CSS `prefers-color-scheme`, overridable via <html data-theme='dark|light'> or <CathodeProvider theme='dark|light'>.",
  "adapters": [
    "react"
  ],
  "imports": {
    "tokens": "import '@cathode-ui/react/tokens.css';",
    "fonts": "import '@cathode-ui/react/fonts.css';",
    "styles": "import '@cathode-ui/react/styles.css';",
    "icons": "import { IconBroadcast, IconChat /* ... */ } from '@cathode-ui/react/icons';"
  },
  "tokens": {
    "$ref": "tokens/tokens.json"
  },
  "components": [
    {
      "name": "TerminalFrame",
      "import": "import { TerminalFrame } from '@cathode-ui/react';",
      "summary": "Bordered box with a small inset title — the \"┌─ PEERS ─\" terminal look. Use to group related readouts.",
      "props": [
        {
          "name": "title",
          "type": "string",
          "required": false
        },
        {
          "name": "accent",
          "type": "'neutral'|'info'|'success'|'warning'|'danger'",
          "required": false,
          "default": "neutral"
        },
        {
          "name": "children",
          "type": "ReactNode",
          "required": true
        },
        {
          "name": "className",
          "type": "string",
          "required": false
        }
      ],
      "motionStates": [],
      "a11y": {
        "role": "region",
        "requires": []
      },
      "feedback": {
        "haptic": null,
        "sound": null
      },
      "examples": [
        {
          "name": "titled",
          "snippet": "<TerminalFrame title=\"PEERS\">{/* children */}</TerminalFrame>"
        },
        {
          "name": "accented",
          "snippet": "<TerminalFrame title=\"ERROR\" accent=\"tx\">…</TerminalFrame>"
        }
      ],
      "whenToUse": "Group a named section of readouts or controls with a visible label — the \"┌─ PEERS ─\" terminal section.",
      "vs": [
        {
          "component": "Card",
          "picker": "TerminalFrame when the section needs a visible name; Card when content speaks for itself."
        }
      ],
      "adapters": {
        "react": {
          "import": "import { TerminalFrame } from '@cathode-ui/react';",
          "examples": [
            {
              "name": "titled",
              "snippet": "<TerminalFrame title=\"PEERS\">{/* children */}</TerminalFrame>"
            },
            {
              "name": "accented",
              "snippet": "<TerminalFrame title=\"ERROR\" accent=\"tx\">…</TerminalFrame>"
            }
          ]
        }
      }
    },
    {
      "name": "Card",
      "import": "import { Card } from '@cathode-ui/react';",
      "summary": "Generic bordered panel — same chrome as TerminalFrame without the inset title. Use for readouts, info blocks, or grouped form fields where the content speaks for itself.",
      "props": [
        {
          "name": "children",
          "type": "ReactNode",
          "required": true
        },
        {
          "name": "accent",
          "type": "'neutral'|'info'|'success'|'warning'|'danger'",
          "required": false,
          "default": "neutral"
        },
        {
          "name": "surface",
          "type": "'flat'|'elevated'",
          "required": false,
          "default": "flat",
          "description": "`elevated` uses panel bg; `flat` is transparent."
        },
        {
          "name": "padding",
          "type": "'none'|'sm'|'md'|'lg'",
          "required": false,
          "default": "md"
        },
        {
          "name": "onClick",
          "type": "() => void",
          "required": false,
          "description": "When set, the Card renders as a focusable button."
        }
      ],
      "motionStates": [],
      "a11y": {
        "role": "region (button when onClick)",
        "requires": [
          "aria-label if clickable and children are icon-only"
        ]
      },
      "feedback": {
        "haptic": null,
        "sound": null
      },
      "examples": [
        {
          "name": "info",
          "snippet": "<Card accent=\"info\" surface=\"elevated\"><DotLeader label=\"LAT\" value=\"42 MS\" /></Card>"
        },
        {
          "name": "clickable",
          "snippet": "<Card onClick={open} aria-label=\"Show details\">…</Card>"
        }
      ],
      "whenToUse": "Wrap any content in a bordered panel without a label — info blocks, grouped form fields, composable widgets.",
      "vs": [
        {
          "component": "TerminalFrame",
          "picker": "Card when you don't need an inset title; TerminalFrame when you do."
        },
        {
          "component": "StatusTile",
          "picker": "Card for freeform content; StatusTile for the standard icon + title + subtitle pattern."
        }
      ],
      "adapters": {
        "react": {
          "import": "import { Card } from '@cathode-ui/react';",
          "examples": [
            {
              "name": "info",
              "snippet": "<Card accent=\"info\" surface=\"elevated\"><DotLeader label=\"LAT\" value=\"42 MS\" /></Card>"
            },
            {
              "name": "clickable",
              "snippet": "<Card onClick={open} aria-label=\"Show details\">…</Card>"
            }
          ]
        }
      }
    },
    {
      "name": "PixelBar",
      "import": "import { PixelBar } from '@cathode-ui/react';",
      "summary": "Discrete-cell horizontal level meter. Fill proportional to `level` (0–1).",
      "props": [
        {
          "name": "level",
          "type": "number",
          "required": true,
          "description": "Clamped to [0, 1]."
        },
        {
          "name": "cells",
          "type": "number",
          "required": false,
          "default": 24
        },
        {
          "name": "fill",
          "type": "string",
          "required": false,
          "description": "CSS color; overrides --cathode-pixelbar-fill."
        },
        {
          "name": "cellSize",
          "type": "number",
          "required": false,
          "default": 6
        }
      ],
      "motionStates": [],
      "a11y": {
        "role": "progressbar",
        "requires": [
          "aria-valuenow set automatically"
        ]
      },
      "feedback": {
        "haptic": null,
        "sound": null
      },
      "examples": [
        {
          "name": "vu",
          "snippet": "<PixelBar level={0.6} cells={24} />"
        }
      ],
      "whenToUse": "Show a real-time VU-meter-style level (volume, signal intensity) as discrete pixel cells.",
      "vs": [
        {
          "component": "ProgressBar",
          "picker": "PixelBar for discrete level meters; ProgressBar for continuous determinate progress (e.g. download %)."
        },
        {
          "component": "ActivityBar",
          "picker": "PixelBar for a known level 0–1; ActivityBar for pseudo-random \"something is happening\" animation."
        }
      ],
      "adapters": {
        "react": {
          "import": "import { PixelBar } from '@cathode-ui/react';",
          "examples": [
            {
              "name": "vu",
              "snippet": "<PixelBar level={0.6} cells={24} />"
            }
          ]
        }
      }
    },
    {
      "name": "PulsingDot",
      "import": "import { PulsingDot } from '@cathode-ui/react';",
      "summary": "Small square that pulses to signal \"active/listening\" without a full progress indicator.",
      "props": [
        {
          "name": "color",
          "type": "string",
          "required": false,
          "default": "currentColor"
        },
        {
          "name": "size",
          "type": "number",
          "required": false,
          "default": 8
        }
      ],
      "motionStates": [
        "pulse"
      ],
      "a11y": {
        "role": "presentation",
        "requires": []
      },
      "feedback": {
        "haptic": null,
        "sound": null
      },
      "examples": [
        {
          "name": "default",
          "snippet": "<PulsingDot color=\"var(--cathode-color-ok)\" />"
        }
      ],
      "whenToUse": "Attach a small live-status signal to a label or row — LIVE / SCANNING / ONLINE.",
      "vs": [
        {
          "component": "Avatar",
          "picker": "PulsingDot for an abstract status indicator; Avatar's status dot when it's tied to a specific person."
        },
        {
          "component": "Badge",
          "picker": "PulsingDot for live animated state; Badge for static labels (NEW / BETA)."
        }
      ],
      "adapters": {
        "react": {
          "import": "import { PulsingDot } from '@cathode-ui/react';",
          "examples": [
            {
              "name": "default",
              "snippet": "<PulsingDot color=\"var(--cathode-color-ok)\" />"
            }
          ]
        }
      }
    },
    {
      "name": "DotLeader",
      "import": "import { DotLeader } from '@cathode-ui/react';",
      "summary": "\"LABEL …………… VALUE\" row — classic terminal readout. Dots fill available width.",
      "props": [
        {
          "name": "label",
          "type": "string",
          "required": true
        },
        {
          "name": "value",
          "type": "string",
          "required": true
        },
        {
          "name": "valueColor",
          "type": "string",
          "required": false,
          "description": "CSS color for the value half."
        }
      ],
      "motionStates": [],
      "a11y": {
        "role": "text",
        "requires": []
      },
      "feedback": {
        "haptic": null,